title,title_length,hashtag_count,tag_count,views,likes,comments,publishedAt,duration
DK vs NS Highlights ALL GAMES | LCK 2026 | Dplus Kia vs NS RedForce,67,0,0,7422,60,18,2026-05-31T12:00:34Z,PT18M19S
PUBG Lite PC Game play Highlights🔥🔥 | Gaming With Emperor,57,0,27,62,10,6,2019-08-25T06:15:58Z,PT11M8S
BLG vs WE Highlights Game 3 | LPL 2026 Split 2 Playoffs | Bilibili Gaming vs Team WE,84,0,0,2055,20,4,2026-05-30T12:49:45Z,PT13M49S
ERANGEL Todays Match Highlights | Pubg PC #gaming #pubg #asmr,61,3,28,56,3,0,2024-02-12T18:30:19Z,PT8M40S
The Framework PC Event Highlights in 15 Minutes (2025),54,0,26,2183,80,13,2025-02-26T09:10:02Z,PT15M46S
PUBG PC : SOLO VS SQUAD HIGHLIGHTS,34,0,0,80,2,2,2026-01-02T08:51:22Z,PT4M39S
⚽ PSG (4) 1-1 (3) Arsenal Final 2026 Highlights | UEFA Champions League 25-26 Simulation/Recreation,99,0,18,1501495,6003,4,2026-05-30T22:09:25Z,PT8M1S
Zone Reject! (PUBG PC Highlights) #pubg #gameplay #gaming,57,3,16,56,3,0,2024-06-24T14:09:02Z,PT13M34S
IND VS ENG | CRICKET GAMING | HIGHLIGHTS | PC CRICKET GAMES,59,0,0,68,18,0,2021-08-14T12:52:59Z,PT5M11S
Best way to record your game Highlights on PC ? with NVIDIA GeForce Experience ( A.K.A. shadowplay ),100,0,7,207,15,7,2021-08-31T20:26:36Z,PT8M18S
PUBG HIGHLIGHTS #3 | ✨PUBG PC GAMING ✨,38,1,8,26,3,0,2023-02-03T11:35:37Z,PT5M7S
What is the Science of Reading? | Special Education,51,0,16,2489,39,3,2021-03-02T19:00:17Z,PT4M40S
"The Science of Teaching, Effective Education, and Great Schools",63,0,6,829660,19529,455,2017-09-15T11:22:21Z,PT6M21S
How do Electromagnets Work? + more videos | #aumsum #kids #science #education #children,87,5,17,1604872,10472,0,2021-06-18T11:30:03Z,PT10M11S
Is Education Science Or arts?|Is Education Science Or arts?|Is Education Science Or arts?,89,0,0,445,15,0,2022-10-09T06:35:17Z,PT6M51S
How does the Moon cause Tides? + more videos | #aumsum #kids #science #education #children,90,5,25,992163,8339,0,2018-08-09T09:10:15Z,PT5M7S
Density - Why does oil float on water? | #aumsum #kids #science #education #children,84,5,27,1426938,11303,0,2017-02-20T13:06:42Z,PT4M19S
How do Hurricanes Form? + more videos | #aumsum #kids #science #education #children,83,5,18,1519129,6914,0,2021-06-07T13:00:01Z,PT11M9S
Why do Volcanoes Erupt? + more videos | #aumsum #kids #science #education #children,83,5,20,1290810,6536,0,2021-05-11T12:30:06Z,PT10M52S
String Theory Explained – What is The True Nature of Reality?,61,0,25,26305809,713740,23293,2018-03-01T13:30:51Z,PT8M
Is Sugar bad for you? + more videos | #aumsum #kids #science #education #children,81,5,18,825064,7635,0,2018-10-14T04:30:00Z,PT6M31S
Are Processed foods Safe to Eat? + more videos | #aumsum #kids #science #education #children,92,5,18,509879,5174,0,2020-01-18T04:30:00Z,PT6M1S
Why do some people Stutter? + more videos | #aumsum #kids #science #education #children,87,5,16,2040651,12511,0,2019-07-05T01:30:00Z,PT4M14S
Why do Blood Types matter? + more videos | #aumsum #kids #science #education #children,86,5,16,621369,6929,0,2019-08-09T01:30:00Z,PT4M15S
How do Batteries Work? + more videos | #aumsum #kids #science #education #children,82,5,18,519406,3158,0,2021-06-03T12:30:03Z,PT12M55S
Blippi's Cool Science Experiments! | Learn Science For Kids | Educational Videos for Toddlers,93,0,38,3464516,5606,0,2021-02-27T12:00:03Z,PT9M42S
How do Mirrors Work? + more videos | #aumsum #kids #science #education #children,80,5,15,2170428,12633,0,2021-06-15T11:30:12Z,PT10M33S
Learn About Weather and States of Matter | Educational Science Video for Kids,77,0,0,7486534,4536,0,2022-05-12T20:08:48Z,PT15M43S
How does an Air Conditioner Work? + more videos | #aumsum #kids #science #education #children,93,5,21,944979,5845,0,2021-05-19T12:30:05Z,PT10M14S
How do Drones Fly? + more videos | #aumsum #kids #science #education #children,78,5,19,643093,3613,0,2021-06-11T11:30:13Z,PT10M30S
How do Hormones work? + more videos | #aumsum #kids #science #education #children,81,5,16,527121,4608,0,2019-09-04T12:00:15Z,PT4M26S
Potential and Kinetic Energy | #aumsum #kids #science #education #children,74,5,24,4961897,53706,0,2015-03-24T13:46:07Z,PT4M28S
A Transparent Ocean: What If? + more videos | #aumsum #kids #science #education #children,89,5,20,21063680,64271,0,2020-03-07T10:30:01Z,PT6M16S
Why do we get Nightmares? + more videos | #aumsum #kids #science #education #children,85,5,19,5532389,26707,0,2019-07-03T01:30:00Z,PT4M16S
Can we Travel Faster than Light? + more videos | #aumsum #kids #science #education #children,92,5,21,3085957,25304,0,2018-09-27T11:45:53Z,PT8M1S
How do Antibiotics Work? + more videos | #aumsum #kids #science #education #whatif,82,5,32,424376,1700,0,2022-10-03T10:30:11Z,PT4M1S
DELED 2nd Year | Science Education | UNIT 4 | LearnCrafted,58,0,25,464,9,2,2025-12-03T12:15:04Z,PT13M53S
Praxis Elementary Education [5005] Science - Everything You Need to Know to Pass [Updated],90,0,12,51112,527,22,2018-10-29T17:32:53Z,PT17M23S
Blippi Learns About the Weather! | Educational Science Videos for Kids,70,0,38,1139178,1790,0,2021-04-17T11:00:12Z,PT10M34S
Why is Fiber Important for us? + more videos | #aumsum #kids #science #education #children,90,5,15,992933,8072,0,2019-10-23T11:30:03Z,PT5M3S
10+ things YOU MUST KNOW before buying LEGO Education Science,61,0,15,6260,95,24,2025-04-25T13:00:52Z,PT6M28S
The science of skin - Emma Bryce,32,0,12,2248959,37427,703,2018-03-12T15:00:21Z,PT5M11S
Black Holes Explained – From Birth to Death,43,0,41,27610800,402201,17615,2015-12-15T16:33:55Z,PT5M56S
Everything You Should Know About LEGO Education Science,55,0,8,4541,83,18,2026-01-27T13:21:27Z,PT7M9S
Seed Germination | #aumsum #kids #science #education #children,62,5,27,9806550,52878,0,2015-12-27T07:40:31Z,PT5M5S
The science of tsunami | How does an Earthquake cause Tsunami | Education.,74,0,26,2446628,1854,57,2022-02-02T12:07:33Z,PT4M7S
Why do we get Dehydrated? + more videos | #aumsum #kids #science #education #children,85,5,17,484930,3375,0,2019-10-02T04:00:02Z,PT4M40S
An Education in Science || Story || By Stephen Hawking,54,0,0,4491,70,4,2020-11-23T18:55:19Z,PT16M57S
"Work, Energy, and Power: Crash Course Physics #9",48,1,12,3380570,41584,1215,2016-05-26T21:00:01Z,PT9M55S
What is Blood Rain? + more videos | #aumsum #kids #science #education #children,79,5,14,1585118,15361,0,2018-12-14T11:28:12Z,PT5M40S
The science of hearing - Douglas L. Oliver,42,0,13,1259054,19707,654,2018-06-19T15:00:58Z,PT5M17S
Aims of Teaching Science | NCF Explained | EduQuick #education,62,1,0,33,3,1,2025-10-02T14:57:29Z,PT4M23S
How do vitamins work? - Ginnie Trinh Nguyen,43,0,14,6735363,88767,2061,2014-10-06T15:18:02Z,PT4M44S
Photosynthesis | #aumsum #kids #science #education #children,60,5,26,7064661,52855,0,2015-09-02T12:38:22Z,PT5M23S
Basics In Behavior Green Lore Explained (Fundamental Paper Education Science Au),80,0,27,339793,6517,362,2024-10-19T16:00:43Z,PT9M6S
Why do bubbles pop? + more videos | #aumsum #kids #science #education #children,79,5,18,2029901,9261,0,2019-05-25T04:00:05Z,PT4M20S
Hydrocarbons | #aumsum #kids #science #education #children,58,5,27,939646,14007,0,2015-10-21T17:10:30Z,PT6M59S
FunScienceTime: What Is Light Refraction? Water Science & Magic Explained | Educational Science STEM,100,0,16,16,1,2,2026-05-09T12:00:49Z,PT7M28S
Physical and Chemical Changes | #aumsum #kids #science #education #children,75,5,18,2307520,14705,0,2015-04-16T12:36:00Z,PT5M35S
Environmental science chapter 1 Class 11|jkbose|ashec|environmental studies|environmental education|,100,0,12,209415,4614,452,2020-08-19T04:30:02Z,PT12M57S
SCIENCE EXPLAINED SIMPLY ! || THALA EDUCATOR #video #science #education,71,3,0,44,11,1,2025-07-07T16:29:54Z,PT16M54S
E Hisid Hoi | Santali AI Cover Song | DM AI Music Present By,60,0,25,1603,24,0,2026-06-02T01:00:13Z,PT5M14S
Lambi Judai - Cover Song | Varsha Singh Dhanoa | Reshma | Echoes of Reshma | Sufiscore |Hero,92,0,26,9303604,82462,1840,2024-07-26T11:30:28Z,PT8M35S
Snehithane Cover (Alaipayuthe) - Masala Coffee  ,48,0,4,78304741,683259,0,2015-11-17T09:00:32Z,PT5M11S
Tera Naam Liya Tujhe Yaad Kiya | 90s Bollywood Cover song | Old is gold | E1 RECORDS,84,0,13,4852873,21460,240,2026-04-08T12:36:56Z,PT5M13S
Chhup Gaye Sare Nazare (Cover Song) | 90’s Hit Romantic Song | Old Is Gold,74,0,0,3788300,13468,135,2026-04-13T01:30:54Z,PT5M6S
Forever Young - Music Travel Love ft. Bugoy Drilon,50,0,14,29972265,173652,5399,2025-04-16T00:00:08Z,PT4M25S
"Har Dil Jo Pyar Karega - Cover | R Joy ft. Ashfa | Salman Khan, Rani Mukherji",77,0,21,13329000,72604,1180,2019-10-03T19:10:01Z,PT5M38S
Dekha Ek Khwab To Silsile Hue ❤️ |  Soulful Cover | Silsila | Old Hindi Love Song | Yadon Ka Sandook,100,0,22,3756604,18669,273,2026-04-06T13:52:42Z,PT8M46S
COVER SONGS JUKEBOX MALAYALAM | 90'S NOSTALGIC | EVERGREEN SONGS | FULL VIBE COLLECTION,87,0,0,2049907,6098,123,2023-09-02T12:37:46Z,PT13M11S
Arul Pragasam | Jukebox | Tamil cover songs,43,0,0,1357773,12081,504,2024-10-04T12:02:36Z,PT11M45S
TOMARI POROSHE || RELAXING COVER SONG { তোমারই পরশে } BANGALI COVER SONG 2025,77,0,14,1935549,16650,377,2025-11-29T14:51:42Z,PT4M11S
Mujhe Neend Na Aaye Banjo Cover | DIL | Bollywood Instrumental By MUSIC RETOUCH,79,0,21,41527521,261416,6931,2019-02-25T02:30:00Z,PT6M5S
और इस दिल में क्या रखा है | Cover Song 2026 | 90s Vibe Romantic Song | Saaj Saagar,82,0,21,4415085,32989,176,2026-04-11T01:15:01Z,PT4M59S
Teri Umeed Tera Intezar (New Lyrics) - JalRaj | New Hindi Covers | 90s Songs,76,0,20,5495091,46868,2744,2025-11-15T13:30:06Z,PT4M41S
Huling Sayaw - Kamikazee | (Cover by: Harmonica Band) Ft. Justine Calucin and Monica Bianca,91,0,0,1779370,0,269,2025-04-25T08:51:00Z,PT4M58S
"Heal the World - Music Travel Love & Friends (Al Madam, UAE)",60,0,9,14241911,88302,2835,2025-07-02T00:00:57Z,PT5M2S
වැහි වැටිලා බිම තෙමිලා | Wahi Watila - Damith Asanka Cover Song | Acoustic Version ,83,0,6,476124,13007,1030,2026-04-24T10:35:00Z,PT4M38S
Khuanu Ruatloh Di -Malsawmtluangi Fanai (cover) by Keneisenuo Sorhie,68,0,0,1994834,41223,3605,2026-02-10T15:06:34Z,PT4M1S
ये दिलवालों की बस्ती है ❤️ | Old Is Gold 90s Cover Song 2026 | Romantic Hindi Song | Saaj Saagar ,97,0,0,5493890,38954,318,2026-05-01T12:30:36Z,PT5M17S
The Version Sessions – Almost Over You – (Cover by Andre Valdez),64,0,25,808827,2806,119,2026-02-16T14:01:38Z,PT4M3S
"""အချစ်အယူခံ"" ( Cover Song )",27,0,0,3466396,19486,892,2024-08-31T09:49:14Z,PT4M22S
MARILAG | Dionela (Soulful vibes cover) #REINEMUSIC,51,1,0,407415,1987,57,2026-02-26T04:00:03Z,PT4M32S
Passenger Seat (R&B x Pop Cover) – Late Night PH,48,0,0,595194,1906,37,2026-03-20T09:15:04Z,PT4M47S
Aadat (Rock Version),20,0,6,5063779,48907,579,2024-09-30T07:05:35Z,PT4M28S
I Wanna Know What Love Is - Music Travel Love & Friends (at Dhafeer Fort #inabudhabi),85,1,8,23057058,139305,3916,2024-07-10T00:00:05Z,PT4M27S
Cry- Cigarettes after S*x (the other person’s pov),50,0,0,12146583,293548,6580,2025-05-11T12:44:31Z,PT4M16S
Skate Avenue PH - Heaven Knows (Rock Cover),43,0,4,60649238,144941,7305,2025-10-18T04:30:14Z,PT4M31S
Islands in the Stream - Music Travel Love & Marsha Milan,56,0,14,25402643,111274,3169,2024-06-05T00:00:03Z,PT4M23S
It Will Rain - Music Travel Love ft. Francis Greg (Bruno Mars Cover),68,0,15,38422131,98460,2869,2022-05-04T00:00:20Z,PT4M27S
More Than Words - Music Travel Love (Extreme Cover),51,0,11,60892441,271149,5403,2019-07-04T00:00:16Z,PT4M12S
Oceans - Hillsong United (cover) by Genavieve Linkowski  | Collab w/ Anthem Worship +  @MassAnthem,98,0,40,5331615,75849,2000,2024-01-05T22:00:18Z,PT4M35S
Rem Ve Thei Se (Phuahtu - Rualthankhuma Chhakchhuak) - (AI Cover),65,0,0,381397,5007,254,2026-04-30T14:46:10Z,PT4M53S
Earth Song (Cover) Incredible Voice,35,0,4,546337,9478,631,2026-03-01T06:31:52Z,PT4M56S
"Evanescence ""My Immortal"" (Acoustic Cover)",42,0,21,3695878,59906,1899,2025-07-25T16:00:10Z,PT4M15S
214 (Motown Soul Jazz-Funk Cover) | Brought To You,50,0,0,943265,2023,121,2025-12-25T12:23:13Z,PT5M10S
Whitney Houston - I Have Nothing | Soulful Male R&B Cover,57,0,0,956019,11137,292,2026-03-27T15:01:16Z,PT4M57S
AYA - MAYBE (RNB COVER),23,0,0,2307862,5479,334,2025-12-14T10:00:06Z,PT4M39S
THROUGH THE YEARS (RNB COVER) | KRIX,36,0,0,3837056,6230,106,2025-12-31T04:00:05Z,PT4M48S
SECRET - HEART | AERA COVERS,28,0,0,665605,0,238,2025-04-30T15:38:33Z,PT4M3S
COVER VIBES STUDIO: NTUNDIZE BY Bruce Melody { Afrosoul cover },63,0,0,116982,1006,55,2026-04-14T11:20:55Z,PT4M34S
Timi Bhanda Ma Pahila Maraula ||NEPALI SUPERHIT SONGS MASHUP COVER || DILIP TAMANG X DIPAK TAMANG,97,0,22,21033128,199151,5798,2021-05-24T11:15:11Z,PT11M22S
Male Voice Singing My Heart Will Go On | You'll Cry,51,0,15,3382564,74622,2374,2026-01-10T16:00:06Z,PT4M57S
Wicked Game - Chris Isaak (Cover by Jack & Daisy),49,0,6,4025356,84740,2343,2025-01-24T17:46:32Z,PT5M29S
The Version Sessions - Go The Distance - (Cover by Andre Valdez),64,0,36,414891,2893,93,2026-03-13T11:47:51Z,PT4M34S
"Pretty Boy - M2M (""Pretty Girl"" Male Version) [REYNE COVER]",59,0,53,2095514,9185,348,2025-06-07T00:00:10Z,PT4M15S
MIMINA NEEMA COVER SONG,23,0,0,1009289,5141,237,2026-04-04T19:58:38Z,PT8M2S
NO MORE RHYME - DEBBIE GIBSON | AERA COVERS,43,0,0,3212592,0,1317,2024-02-04T05:35:46Z,PT4M18S
"When Love And Hate Collide, Def Leppard - Serenade Studio ( Rock Cover )",72,0,0,2015264,4085,101,2026-01-30T06:08:30Z,PT4M12S
I Do Cherish You - Michael Pangilinan,37,0,0,4627927,12813,412,2025-07-27T08:59:58Z,PT4M5S
If Ever You’re in My Arms Again - Peabo Bryson (Acoustic Cover by Francis Greg),79,0,11,26731065,30603,803,2025-04-15T04:00:07Z,PT4M10S
6 Tips on Being a Successful Entrepreneur | John Mullins | TED,62,0,10,4167323,74822,965,2024-02-09T19:47:43Z,PT15M20S
How to Grow Your Business SO Fast it Feels Like CHEATING,56,0,3,239968,6885,446,2025-07-29T15:00:51Z,PT16M18S
How to Actually Start Your Own Business (No-Bs Guide),53,0,17,310295,10791,200,2025-09-15T14:15:01Z,PT11M1S
"If You Want to Get Rich, DON’T Start a Business",47,0,0,1330842,49124,889,2023-06-19T18:21:55Z,PT10M7S
A CEO’s 15 Tips to Building a Successful Business,49,0,16,354699,14673,1767,2023-03-22T17:50:09Z,PT11M54S
How to Know If You're Meant to Be An Entrepreneur | Kiki Ayers | TEDxBuckhead,77,0,8,867355,34289,1342,2021-01-25T16:05:38Z,PT16M45S
6 tips on being a successful entrepreneur | John Mullins | TEDxLondonBusinessSchool,83,0,6,215291,3629,189,2023-08-24T17:00:20Z,PT16M46S
OUTWORK AND GRIND! | Brutally Honest Business Advice from Mark Cuban,68,0,23,277410,5885,96,2024-09-02T15:00:03Z,PT10M31S
10 Tips for Starting your Own Business [ Must Watch ],53,0,6,1491519,22785,508,2016-06-15T13:11:03Z,PT4M29S
50 Entrepreneurs share priceless advice,39,0,8,5094136,110069,4542,2014-12-07T16:36:48Z,PT18M40S
"""I Got Rich When I Understood This"" | Jeff Bezos",48,0,21,15198541,266935,16607,2022-05-16T14:00:03Z,PT8M14S
18 Minutes of the Best Entrepreneur Advice to Grow Your Business Fast,69,0,29,66847,1393,135,2025-04-28T14:00:57Z,PT18M18S
7 Habits of Successful Businessmen | Rajiv Talreja,50,0,4,116049,2686,111,2023-04-25T14:15:11Z,PT14M2S
7 Strategies to Grow Your Business | Brian Tracy,48,0,24,2422939,19435,1169,2019-03-21T17:00:04Z,PT4M40S
How to Strategize as an Entrepreneur,36,0,13,343655,10882,374,2016-11-29T14:19:49Z,PT15M32S
How to Scale Your Business? || What is Ansoff Matrix? || Rahul Malodia,70,0,19,558983,15973,447,2022-08-08T13:45:46Z,PT5M48S
The Power of an Entrepreneurial Mindset | Bill Roche | TEDxLangleyED,68,0,23,1128799,21066,434,2018-03-20T16:18:49Z,PT16M21S
how to start your first business (as a student),47,0,0,495825,18639,956,2025-06-30T22:41:33Z,PT15M1S
17 Tips to Run a Small Business & PREVENT Business Failure,58,0,10,428187,6344,101,2016-10-09T15:59:15Z,PT4M26S
Entrepreneurship Made Simple: 4 Easy Ways To Start Your Own Business | Chinkee Tan,82,0,13,142607,3461,173,2023-04-03T12:00:09Z,PT8M4S
How To Become a Millionaire on a 9-5 Salary,43,0,0,2510022,108189,3252,2024-12-10T16:00:27Z,PT14M6S
The BEST Advice for Entrepreneurs - Robert Kiyosaki,51,0,24,611950,16027,561,2020-05-08T21:15:10Z,PT12M49S
3 Fundamental of a Successful Business,38,0,0,157604,5994,126,2023-04-09T14:00:16Z,PT13M58S
Grow Your Business 10x FASTER with These Proven Strategies,58,0,21,119695,3174,156,2024-10-06T13:00:32Z,PT8M41S
How to Start a Profitable #Business? | #Entrepreneurship Secrets | #GoSelfMadeUniversity,88,3,32,957816,46767,2007,2021-05-02T08:30:04Z,PT19M20S
Steve Jobs on Starting A Business,33,0,13,496095,13961,383,2017-10-15T04:25:47Z,PT10M7S
How to start a Business by Dhruv Rathee | Being an Entrepreneur in India,72,0,27,5132640,208554,6388,2018-05-24T13:14:02Z,PT15M24S
Entrepreneur VS Businessman | Anurag Aggarwal | #vs | #comparison | #business | #businessman,92,4,24,384014,11150,278,2023-07-28T14:00:09Z,PT5M43S
7 Tips on When to Go Full Time as an Entrepreneur,49,0,11,90442,2741,183,2016-05-19T12:38:39Z,PT12M38S
Entrepreneur Mentality | सबसे विकसित सोच रखनी होगी | Harshvardhan Jain,70,0,19,715473,25013,376,2022-03-12T01:30:06Z,PT12M35S
Africa is the ultimate destination for unlimited business ideas and opportunities - Jack Ma,91,0,27,1705622,23089,1200,2023-05-29T17:48:02Z,PT17M14S
How To Write a Business Plan To Start Your Own Business,55,0,11,4967148,66844,1110,2016-06-29T10:27:03Z,PT8M50S
How to Know You're NOT Meant to Be an Entrepreneur | Kevin O'Leary,66,0,27,599026,11883,1310,2025-09-20T13:01:21Z,PT8M59S
ADHD as an Entrepreneur’s Superpower | John Torrens | TEDxSyracuseUniversity,76,0,9,420010,10058,674,2018-06-27T16:10:56Z,PT15M1S
The single biggest reason why start-ups succeed | Bill Gross | TED,66,0,10,6900356,157200,2654,2015-06-01T21:02:03Z,PT6M41S
Child entrepreneurs turning ideas into money making businesses | A Current Affair,81,0,10,75073,709,0,2022-01-18T00:15:01Z,PT4M30S
What is Entrepreneurship? | 10 shared characteristics of entrepreneurs | From A Business Professor,98,0,0,383152,7081,497,2024-10-25T04:00:49Z,PT11M11S
HOW To Start YOUR OWN BUSINESS in 2026! MASTERPLAN,50,0,18,1465004,75655,1806,2024-01-20T10:37:36Z,PT9M20S
Best Tips for Startup Entrepreneurs,35,0,14,57156,2226,54,2014-09-25T20:33:20Z,PT6M36S
"These 4 Skills Will Make you Rich in Any Business! 4 Skills to Make Your Business Successful, Famous",100,0,23,2160797,56895,950,2023-10-20T01:46:01Z,PT10M17S
Is an MBA important to start a business? | Management for entrepreneurs | Ankur Warikoo Hindi Video,99,0,19,103333,5614,377,2021-04-08T16:00:18Z,PT12M22S
Nikhil Kamath: My Honest Business Advice,40,0,26,225849,4352,102,2025-04-15T12:30:03Z,PT4M23S
7 ADHD Traits Excellent For Entrepreneurship,44,0,23,8345,454,45,2022-10-10T13:00:06Z,PT8M49S
Hiring Your First Employee as an Entrepreneur,45,0,13,262032,9073,342,2017-02-28T14:00:03Z,PT6M10S
30 Years of Business Advice in 13 Minutes (from a Billionaire),62,0,0,747337,25929,1825,2026-02-20T17:00:02Z,PT13M5S
ENTREPRENEUR MENTALITY - Powerful Business Motivation,53,0,30,148240,2331,80,2024-08-26T15:00:47Z,PT16M4S
How to Build a Dream Team as an Entrepreneur,44,0,14,227571,8095,295,2017-06-27T13:00:59Z,PT16M32S
10 Business Skills That Print Money Forever,43,0,4,153914,6456,206,2025-10-26T16:44:25Z,PT16M20S
I Wish I Knew This Before Starting A Business,45,0,11,2894496,83594,1502,2023-04-03T17:45:53Z,PT11M5S
Richard Branson: Advice for Entrepreneurs | Big Think,53,0,19,2246024,17565,1381,2011-06-02T15:48:45Z,PT4M4S
"Ireland v ​West Indies Women | Match 4 | Women's T20I Tri Series, 202​6 | Match Highlights",90,0,15,12243,307,8,2026-06-02T06:32:38Z,PT10M32S
Kemp Stars With Bat & Ball | Highlights - England v India | 2nd Women’s Vitality IT20 2026,90,0,8,565525,6211,336,2026-05-30T18:06:18Z,PT15M2S
ENG W vs IND W | 2nd T20I | Highlights | India Women's Tour Of England 2026,75,0,26,48269,581,24,2026-05-30T19:00:24Z,PT13M1S
Captain Virat Marshals His Troops to Victory! | India Tour Of England 2021,74,0,28,63032,1389,28,2026-05-31T18:01:01Z,PT13M21S
भारत बना चैंपियन | Hindi Highlights | IND v NZ | Men’s T20 World Cup Final,74,0,34,10226270,68209,2348,2026-03-08T19:51:42Z,PT5M1S
IPL 2026 Final RCB vs Gujarat Titans Full Match Highlights.,59,0,9,219848,2269,74,2026-05-31T18:06:28Z,PT16M30S
Short Match Highlights | Pakistan vs Australia | 1st ODI | ODI Series 2026 | PCB | M9J1H,88,0,17,308450,2985,100,2026-05-30T21:02:53Z,PT10M4S
"Ireland v ​Pakistan Women | Match 3 | Women's T20I Tri Series, 202​6 | Match Highlights",87,0,12,72195,1054,67,2026-06-01T12:03:32Z,PT10M42S
Super11 Asia Cup 2023 | Final | India vs Sri Lanka | Highlights,63,0,0,105107410,1132811,39206,2023-09-17T14:34:40Z,PT11M54S
Super11 Asia Cup 2023 | Super 4 | Pakistan vs India | Full Match Highlights,75,0,0,101486388,905980,24725,2023-09-11T18:33:27Z,PT11M47S
"Pakistan v ​West Indies Women | Match 2 | Women's T20I Tri Series, 202​6 | Match Highlights",91,0,14,69289,566,23,2026-05-30T14:51:36Z,PT9M58S
Jemimah Rodrigues Stars With Runs | Highlights - England v India | 1st Women’s Vitality IT20 2026,97,0,8,2604376,30948,965,2026-05-28T21:01:54Z,PT14M17S
Australia v India 2025-26 | Second T20I,39,0,4,10919923,97820,4284,2025-10-31T13:00:00Z,PT8M2S
India v USA | Match Highlights | Men’s T20 World Cup 2026,57,0,34,8296784,77913,2750,2026-02-07T23:11:53Z,PT7M
1st Innings Highlights | Pakistan vs Australia | Match 01 | ODI Series 2026 | PCB | M9J1H,89,0,17,391145,4120,139,2026-05-30T15:49:54Z,PT14M45S
Cricket World Cup 2011 Final: India v Sri Lanka | Match Highlights,66,0,33,29245596,282379,7113,2024-02-23T03:54:36Z,PT8M28S
भारत की सुपर 8 में जगह पक्की | Hindi Highlights | PAK vs IND | Men’s T20 World Cup,82,0,34,7075705,46865,1816,2026-02-15T19:56:54Z,PT4M59S
Rohit Sharma Hits 140! | India v Pakistan - Match Highlights | ICC Cricket World Cup 2019,89,0,27,120179379,965492,50027,2019-06-16T19:03:56Z,PT6M15S
RCB vs GT IPL 2026 Final Full Match Highlights | Bangalore vs Gujarat IPL 2026 Final Highlights,95,0,0,65667,304,7,2026-06-01T07:00:13Z,PT13M
"RCB vs GT FINAL IPL 2026 full highlights, Bangalore vs Gujarat IPL 2026 FINAL Full Highlights",93,0,0,141206,358,2,2026-05-31T16:23:02Z,PT16M1S
"Highlights: Australia v India, MCG | ODI Tri-Series 2014-15",59,0,12,58702768,345794,5061,2015-01-18T12:46:26Z,PT12M4S
Rohit Hundred Seals Win | South Africa vs India - Match Highlights | ICC Cricket World Cup 2019,95,0,28,52794054,506785,9704,2019-06-05T18:21:12Z,PT5M8S
Australia v India 2025-26 | Third ODI,37,0,4,16132360,173412,4942,2025-10-25T11:00:52Z,PT8M14S
भारत पहुँचा फाइनल में | Hindi Highlights | IND v ENG | Men’s T20 World Cup 2026,79,0,34,10506899,63437,2290,2026-03-05T18:35:34Z,PT5M
Cricket World Cup 2023 Final: Australia v India | Match Highlights,66,0,32,39846101,363275,28600,2024-02-12T01:00:13Z,PT9M3S
Australia v India | WTC23 Final | Match Highlights,50,0,28,16336301,170983,6690,2024-02-13T03:00:17Z,PT12M2S
Super11 Asia Cup 2023 | Super 4 | India vs Sri Lanka | Highlights,65,0,0,36704978,419887,8806,2023-09-12T18:28:38Z,PT12M7S
ENG W vs IND W | 1st T20I | Highlights | India Women's Tour Of England 2026,75,0,26,155411,2031,49,2026-05-29T06:34:20Z,PT12M19S
भारत की सेमी-फाइनल में जगह पक्की | Hindi Highlights | IND v WI | Men’s T20 World Cup 2026,89,0,34,9424899,63182,1641,2026-03-01T18:42:51Z,PT5M1S
PAK vs AUS 2nd ODI 2026 Full Highlights Pakistan’s UNBELIEVABLE Comeback! 🔥,75,0,13,34156,416,22,2026-06-01T11:51:26Z,PT7M27S
Sachin Tendulkar's Sublime Innings That Sealed the Series against Pakistan after 24 years in India,98,0,31,3545141,13599,354,2023-09-01T14:30:09Z,PT13M49S
2nd Innings Highlights | Pakistan vs Australia | Match 01 | ODI Series 2026 | PCB | M9J1H,89,0,17,190425,2025,65,2026-05-30T19:04:57Z,PT14M46S
भारत की ज़िम्बाब्वे पर अहम जीत | Hindi Highlights | IND v ZIM | Men’s T20 World Cup 2026,88,0,34,5010606,29675,866,2026-02-26T19:04:46Z,PT5M1S
भारत की T20 इतिहास की सबसे बड़ी जीत | Hindi Highlights | IND v NAM | Men’s T20 World Cup 2026,93,0,34,5382865,38329,929,2026-02-12T18:20:26Z,PT5M1S
PAK vs AUS 1st ODI Highlights 2026 | Pakistan vs Australia Full Match Highlights | Babar Azam 🔥,95,0,0,17005,85,0,2026-05-31T17:18:18Z,PT9M43S
भारत की लगातार चौथी जीत | Hindi Highlights | IND v NED | Men’s T20 World Cup 2026,81,0,34,4645417,31533,1098,2026-02-18T18:09:54Z,PT5M1S
Jason Roy makes 150th T20 appearance against Kent  | VITALITY BLAST HIGHLIGHTS,78,0,0,10372,162,5,2026-05-31T18:29:11Z,PT11M58S
Australia v India 2025-26 | Second ODI,38,0,4,7667184,81006,3980,2025-10-23T12:45:00Z,PT8M19S
Royal Challengers Bengaluru vs Gujarat Titans IPL 2026 Final highlights | Full Match Highlights 2026,100,0,14,193627,1100,26,2026-05-31T18:46:51Z,PT4M2S
RCB Vs GT IPL 2026 Final HIGHLIGHTS: RCB IPL 2026 Winner। RCB Vs GT IPL 2026 Match Highlights,93,0,15,58642,0,11,2026-05-31T18:52:42Z,PT13M43S
The Intense Rivalry: India Vs Pakistan cricket match highlights,63,0,24,14311510,47355,739,2023-07-16T14:45:01Z,PT19M17S
Ireland v New Zealand | Only Test | Day 2 Highlights,52,0,11,118743,2025,88,2026-05-28T21:21:00Z,PT9M55S
The Innings Which Changed T20 Cricket Forever | 304 Runs,56,0,7,11856314,123682,3647,2026-02-04T09:00:05Z,PT17M33S
Pant and Pandya Sparkle For India | Highlights - England v India | 3rd Men's Royal London ODI 2022,98,0,24,19993991,340096,13910,2022-07-17T18:54:44Z,PT15M2S
England v Pakistan | Urdu Highlights | Men's T20 World Cup 2026,63,0,34,3206893,25412,1060,2026-02-24T19:01:01Z,PT5M31S
Hardik Pandya Shines With Bat And Ball | India Tour Of England 2022,67,0,27,144162,2081,23,2026-05-26T18:27:46Z,PT12M13S
