title,title_length,hashtag_count,tag_count,views,likes,comments,publishedAt,duration
Everyday Tech You’ll Actually Use,33,0,9,6378168,148878,4805,2025-05-28T14:40:48Z,PT18M5S
Audi A6 45 TFSI Technology 2024- ₹70 lakh | Real-life review,60,0,35,422134,6310,211,2024-06-21T10:45:00Z,PT14M57S
Scaler School Of Technology Review by Student | Pros & Cons | Experience | Fees | Academics etc.,96,0,4,58634,1612,271,2025-03-06T13:03:06Z,PT6M37S
Xiaomi 17 Pro Max review - Apple are you seeing this!?,54,0,4,11933307,275919,14444,2025-09-26T00:00:01Z,PT12M57S
Dope Tech: STILL so good!,25,0,9,3911073,91429,2459,2025-11-21T19:00:50Z,PT16M54S
Newton School of Technology Honest Review | Join in 2024 ?? 🤔🤔,62,0,19,21577,397,84,2024-05-02T06:30:03Z,PT12M58S
9 niche tech products that improved my life,43,0,5,1152470,30650,522,2024-11-29T14:00:24Z,PT9M19S
K S Rangasamy College of Technology Review 2024 | Courses |Fees|Placement|TNEA 2024 Expected Cut Off,100,0,11,31409,465,44,2024-01-02T03:30:13Z,PT9M28S
"Audi A4 Technology Top Model 2024 Review, Features, On Road Price",65,0,28,76562,728,11,2024-07-05T15:00:04Z,PT6M48S
2024 RDX Technology Package Full Review - What's New For 2024?,62,0,0,26815,307,52,2023-12-26T22:00:08Z,PT14M3S
2024 Volkswagen Atlas Cross Sport SE w/Technology Review,56,0,12,10226,100,7,2023-11-22T23:42:47Z,PT12M10S
Technology Industry Quarterly Review Q1 2024,44,0,10,91,0,0,2024-05-30T19:01:52Z,PT6M16S
Haldia Institute of Technology 2024 🔥Pros VS Cons 😱Review as an Ex-Student😱 PLACEMENT 🔥FEES❓CUT OFF📝,100,0,9,12058,243,124,2024-07-16T04:30:16Z,PT12M9S
"Students Review |Chennai Institute of Technology|CIT,Chennai-1399|We’ve Own Startup|Friendly Campus",99,0,14,62231,850,150,2024-05-01T10:30:06Z,PT12M24S
BMW i4 review – can this electric car REALLY beat Tesla? | What Car?,68,0,0,431216,3006,551,2022-04-16T07:30:05Z,PT12M59S
iPhone 2024 full Review#technology #gadgets #phone,50,3,1,875,1,0,2023-01-30T23:13:15Z,PT5M50S
"[2024 Best AI Paper] Sora: A Review on Background, Technology, Limitations, and Opportunities of Lar",100,0,0,40,0,0,2024-10-17T04:00:30Z,PT15M9S
The Problem with this Humanoid Robot,36,0,7,6640562,204841,20924,2025-10-30T01:46:49Z,PT16M12S
lElon Musk's New Favorite: Tesla Cybertruck Review 2024 | Trending Car Technology,81,0,0,8,2,1,2024-01-12T17:38:09Z,PT8M55S
FIRST LOOK! 2024 Toyota RAV4 hybrid XSE technology model review!,64,0,4,263955,1143,209,2023-10-22T23:11:00Z,PT9M15S
Madras Institute of Technology 2024 Expected Cutoff & Rank | MIT Campus Review,78,0,0,36001,924,185,2024-06-09T13:00:45Z,PT11M57S
Is this the Ultimate Smartphone? (Xiaomi 17 Pro Max),52,0,12,2386040,15826,1554,2025-10-27T16:20:06Z,PT10M53S
Apple is SO Close to Winning Me - iPhone 17 / iPhone Air Long Term Review,73,0,19,1054498,31731,1810,2025-12-31T17:57:40Z,PT10M27S
PICT Pune College Review 2024 | Pune Institute of Computer Technology College Review,84,0,16,28269,344,46,2024-06-23T09:07:56Z,PT12M43S
😱 Don't buy Smartphones NOW 🤯 Top 10+ Upcoming Smartphone in June 2026,70,0,25,100228,3342,271,2026-05-26T12:17:41Z,PT9M11S
1399-Chennai Institute of Technology | Honest review| over hyped ah❗️|2025 cut off & students review,100,0,0,27783,814,255,2025-06-21T10:24:32Z,PT10M27S
2024 Tata Nexon Walk around review in Telugu | Safety meets technology,70,0,0,19425,196,7,2024-09-13T13:11:11Z,PT8M17S
Polaris School of Technology Review | Polaris School Review 2024,64,0,8,3993,72,7,2024-07-22T12:57:41Z,PT8M42S
"Bangalore Institute of Technology (BIT) College Review 2024: Admission, Placement, Cut Off",90,0,17,23573,202,89,2024-07-28T17:30:07Z,PT9M52S
Tech Review #technology #tech #review #technical #bangla #techbd,64,6,20,6,0,0,2024-04-01T06:22:38Z,PT9M59S
"New Audi A6 Technology 2025 Review, Features, On Road Price",59,0,22,68130,751,21,2025-04-25T13:30:05Z,PT10M27S
Yamaha DRIVE Low Speed Steering Technology | Detailed Review & On Water Demonstration,85,0,21,49717,1318,52,2022-12-08T22:00:09Z,PT8M25S
NEW! Technology All new Sollar 2024 REVIEW! From TeslaX - Elon musk,67,0,0,32,1,0,2024-03-13T03:33:35Z,PT10M9S
Review Of Science & Technology Mind Map Book For UPSC CSE 2024/25. @theaspirantdiaries #upsc2024,96,1,0,7111,147,33,2023-07-09T03:30:09Z,PT7M40S
TESLA CYBERTRUCK 2024 - Vehicle Review #ev #cars #technology #electric #review #cybertruck #tesla,97,7,5,130,1,0,2024-03-24T17:32:48Z,PT9M37S
Ford Mustang Mach-E 2024 Battery and Technology Review,54,0,8,7380,138,6,2024-07-25T12:00:17Z,PT14M
Annual Review 2024 | Leveraging technology | Michel Ganado and Andrew Schembri,78,0,5,93,1,0,2024-10-31T14:38:48Z,PT4M18S
2024 Acura TLX Technology: TEST DRIVE+FULL REVIEW,49,0,17,11964,229,24,2024-01-28T23:43:49Z,PT17M45S
Minisforum N5 Max Review - THE SCORE TO BEAT?,45,0,25,7465,267,30,2026-05-29T14:00:02Z,PT18M41S
Was I Wrong About the Macbook Neo?,34,0,13,2328937,58189,4609,2026-04-23T17:01:40Z,PT18M11S
"2024 Mercedes-Benz E-Class Review | Luxury, Technology, and Performance",71,0,15,43,3,0,2024-07-16T08:14:04Z,PT4M27S
New Audi A4 Technology 40 TFSI 2026 | Premium Luxury Sedan | Detailed Review | ,79,0,0,25940,277,8,2026-02-22T13:47:12Z,PT12M49S
SEPTEMBER 2024 ┃PROFESSIONAL EDUCATION LET REVIEW DRILLS (EDUCATIONAL TECHNOLOGY),81,0,0,35,1,0,2024-06-26T20:56:23Z,PT14M2S
Scaler school of Technology full Review In Telugu.Best Private College?,71,0,12,15945,479,137,2025-06-03T11:52:08Z,PT19M32S
Creta Facelift 2024 (E) Base Variant @10.99lacs Rupees||Technology Review by Trending Technology.,97,0,12,281,2,0,2024-01-17T02:38:40Z,PT4M4S
Tigor XZA+ iCNG 2024 Sedan @9.54lacs Technology Review By Trending Technology.,78,0,19,254,2,0,2024-02-24T04:05:08Z,PT4M42S
Hyundai i30 N 2024 review: Sedan | Facelift brings sharper looks and technology to Subaru WRX rival!,100,0,12,20169,220,59,2024-02-29T13:01:02Z,PT17M8S
Apple 2024 Mac mini Desktop Computer with M4 chip Review 2026,61,0,12,2,0,0,2026-06-01T09:07:45Z,PT4M11S
Educational Technology Review,29,0,0,7,0,0,2024-05-31T17:24:09Z,PT9M54S
TOYOTA CHEAP ELECTRIC PICKUP 2024 - Vehicle Review #ev #cars #technology #electric #Tech #toyota,96,6,0,192,4,0,2024-01-24T14:30:08Z,PT9M4S
"5 minutes! Fast, easy and delicious! And breakfast is ready!",60,0,28,4032217,31650,1643,2024-12-17T14:00:06Z,PT13M47S
The most delicious recipe for pork belly! This recipe will become a family favorite! | 2 RECIPES,96,0,12,992557,4548,146,2024-04-01T11:30:20Z,PT11M16S
"Better than fries! Don't go to McDonalds anymore! Crispy, delicious and very easy! Simple recipe",96,0,26,9640596,42703,2306,2024-04-27T18:35:00Z,PT4M34S
The Most Addictive Chicken Recipe on the Internet! Sooo Delicious 😋 🔥🍗 | 2 RECIPES,82,0,19,975561,8658,294,2025-01-03T12:31:01Z,PT9M33S
Shoot VIRAL Cooking Videos on Phone📱Live Filming Recording Secrets #cookingvideo #youtube #viral #yt,100,4,16,258776,0,1567,2025-11-07T16:02:00Z,PT11M11S
"Hast du Reis und Eier zu Hause? 😋2 Rezepte schnelle, einfache und sehr leckere # 168",84,1,33,49832584,372183,8869,2022-09-29T18:01:27Z,PT8M5S
Quick & Easy Recipes With Gordon Ramsay,39,0,19,21438844,506558,14680,2020-03-29T17:00:15Z,PT13M8S
Turn 2 Eggs Into Fluffy Japanese Soufflé Pancakes!,50,0,0,20177106,486753,11968,2024-08-28T16:44:27Z,PT5M26S
१० कुकिंग टिप्स जो आपने पहले नहीं सुना होगा | 10 Amazing Cooking Hacks | KabitasKitchen,87,0,26,16636367,236463,4434,2020-03-14T07:08:39Z,PT11M14S
Poori Recipe Bazar Jesi sirf 3 Ingredients sai banaye - Perfect Soft Puri by Lively Cooking,91,0,18,3641102,26438,658,2022-07-23T12:09:14Z,PT6M41S
"cooking is easy, actually",25,0,2,178312,9503,373,2025-07-14T04:58:59Z,PT10M30S
"If you have 3 potatoes, prepare this simple and delicious potato dish.",70,0,26,48203845,540040,9453,2022-11-03T15:25:49Z,PT8M49S
How to make PERFECT CHURROS with Hot Chocolate,46,0,13,8952277,162504,2404,2022-09-05T14:40:32Z,PT4M1S
Make Churros Like a Pro – No Special Skills Needed!,51,0,0,4396038,84549,926,2024-10-22T07:17:38Z,PT8M2S
Basic Knife Skills,18,0,32,15627151,359415,5219,2017-09-24T15:00:53Z,PT6M34S
THIS RICE DISH IS DELICIOUS,27,0,0,1655988,19409,414,2022-04-26T12:59:55Z,PT5M6S
Creamy Cajun Chicken Pasta | How To Make Cajun Chicken Pasta,60,0,18,7687189,271555,3566,2022-01-19T22:49:23Z,PT7M57S
Home-Made Pizza Recipe (2 Easy Ways) - Gas Cooker Method/Oven Method - ZEELICIOUS FOODS,87,0,5,8221638,164674,3400,2020-08-08T10:52:05Z,PT12M22S
STOP Scrolling! This Chicken Liver Recipe Changes EVERYTHING 🍗💥 SARAP NITO GRABE 😲👍,83,0,17,14402262,83087,1243,2023-08-16T12:36:11Z,PT5M27S
How to Make Spicy Rice Cakes at Home | Korean Rice Cake Recipe | Korean Street Food – Tteok-bokki,97,0,27,2261191,38361,632,2022-06-20T10:11:50Z,PT4M40S
Chocolate Cake in Pressure Cooker | Chocolate Cake Without Oven | Birthday Cake Recipe,86,0,7,18071597,151824,2350,2020-12-05T09:36:36Z,PT6M51S
Whole Goat Pilaf Recipe | Step by Step Cooking Tutorial,55,0,33,6327570,43577,1921,2023-08-13T20:00:09Z,PT18M33S
Make VIRAL Cooking Shorts in 5 Minutes? || Short Cooking Video Kaise Banaye,75,0,15,30678,762,129,2025-02-05T14:30:55Z,PT15M41S
Crispy Egg Paratha Recipe | Healthy Breakfast |Street Style Egg Paratha Recipe | Anda Paratha Recipe,100,0,22,1850575,17344,327,2025-10-03T09:30:07Z,PT7M52S
5 Tips for BETTER Cooking Videos,32,0,10,292622,9008,301,2022-08-27T21:27:15Z,PT6M52S
Caramel Bread Pudding | Easy Dessert recipe,43,0,12,3459638,37263,710,2021-06-05T08:08:00Z,PT6M19S
Vegetable Dum Biryani | Biryani Recipe | Dum Biryani | Flavored Rice Recipes | Veg Recipes,90,0,26,4953075,62866,1013,2019-06-25T13:11:48Z,PT4M2S
POV: How to Make an Omelette Like a Chef,40,0,24,4047864,37960,2123,2023-09-06T18:00:10Z,PT6M56S
Every Way You Can Cook an Egg,29,0,32,4077184,91370,2047,2025-02-14T17:08:10Z,PT11M13S
सबसे आसान चिकन बनाने का तरीका लाजवाब स्वाद में उंगलिया चाटने पर मजबूर हो जाओगे | Chicken Recipe ,96,0,16,58629,1084,69,2026-05-29T07:07:05Z,PT8M12S
Vanilla Cake Recipe | Vanilla Cake Without Oven | Birthday Cake Recipe,70,0,11,6334095,54275,1142,2021-01-24T06:30:24Z,PT5M46S
Rosé Cooks Kimchi Fried Rice Dinner | Now Serving | Vogue,57,0,27,8141007,352238,8267,2024-10-19T16:00:01Z,PT10M47S
"How to Shoot Professional Cooking Videos with Your mobile, Cooking Channel Video shoot",86,0,10,2852725,27735,2843,2023-02-19T08:22:18Z,PT5M44S
Master Gravy for 50+ Dishes | How to make gravy | Gravy tutorial | Hossain Chef,79,0,24,2166463,32155,2209,2024-03-01T11:30:05Z,PT16M27S
Butter Chicken | Chicken Butter Masala | Chicken Recipe | Non Veg Curries | Home Cooking Show,93,0,21,5874042,80259,1278,2019-04-25T14:09:19Z,PT5M42S
I Tested the MOST TRENDING TikTok Recipes! 🍣,44,0,18,1468128,19502,468,2025-10-25T14:15:07Z,PT19M33S
How to Cook | Pork Menudo Recipe | FOR ANY OCCASIONS | ASMR COOKING by Luto Ni Nanay #14,88,1,5,5286505,30467,722,2020-01-01T17:12:01Z,PT8M
പൊറോട്ട | Soft Layered Parotta Recipe (Kerala Porotta or Paratha) - Easy cook recipe in Malayalam,97,0,13,9715528,167209,14960,2020-05-08T04:12:42Z,PT13M41S
The 5 Skills Every Chef Needs to Learn,38,0,24,1033421,19311,705,2025-01-07T19:30:07Z,PT9M51S
Deliciously Simple Dinner Recipes | Gordon Ramsay,49,0,17,23979775,389717,12150,2020-06-11T16:09:43Z,PT19M13S
ऐसे बनाये वेज मोमोस | Veg Momos Recipe | Summer Recipe | Easy way to fold momos | Kunal Kapur,93,0,27,6586141,104500,1620,2020-12-09T06:05:02Z,PT12M11S
How I would learn to cook if I could start over.,48,0,10,366876,16971,710,2025-06-25T16:58:00Z,PT17M23S
How To Cook The Perfect Steak,29,0,20,17941710,238686,7926,2023-09-02T16:00:19Z,PT17M42S
10 Easy Milkshake Recipe – How to Make Milkshake at Home,56,0,20,23680960,302743,2350,2020-05-02T10:18:07Z,PT7M31S
White Sauce Pasta Recipe |Pasta in White Sauce|No Cheese No Maida White Pasta|Restaurant Style Pasta,100,0,21,2891084,35503,823,2022-06-06T11:30:12Z,PT4M10S
SHAWARMA Step by Step Recipe by (YES I CAN COOK),48,0,33,8593939,137307,1663,2021-01-25T17:30:25Z,PT12M26S
How to Make Samosa | Perfect Samosa Recipe,42,0,16,5271973,59647,1019,2020-04-23T15:00:02Z,PT6M16S
You will want to make your OWN Samosa Wraps at Home | Chef D Wainaina,69,0,5,3896379,50575,2413,2023-07-14T13:00:16Z,PT19M53S
Complete Guide to Making Macarons | Macaron Recipe,50,0,23,3603900,82573,2441,2021-02-18T20:00:01Z,PT11M41S
Our Last Day in India🇮🇳… We Didn’t Want to Leave!,49,0,20,17957,669,174,2026-02-03T16:02:08Z,PT14M10S
Darjeeling: Most Beautiful Place in West Bengal | India's Highest Toy Train | Kanchenjunga View,95,0,18,7727688,129977,5027,2024-02-10T13:53:41Z,PT14M8S
I Fly Air India First Class - I Wasn't Expecting This!,54,0,0,279417,10812,692,2026-05-31T16:00:06Z,PT18M14S
India vs Pakistan… The Truth After Visiting Both 🇮🇳🇵🇰 ,54,0,31,988040,21432,6618,2025-11-22T13:01:55Z,PT19M26S
First Impressions of India - Comparing Old and New Delhi // India Travel Vlog,77,0,21,444255,17828,639,2022-10-23T14:00:01Z,PT17M50S
I spent 4 Days Inside INDIA'S LONGEST TRAIN (78+ Hours)  🚂,58,0,22,11926948,445475,12347,2022-07-31T08:53:53Z,PT17M20S
Exploring Kerala ALONE / The Paradise of India,46,0,0,1764187,70547,4149,2025-09-10T15:30:38Z,PT19M13S
Living on a Luxurious Cruise for 50 Hours,41,0,24,6558839,146456,5711,2024-12-22T06:57:25Z,PT14M32S
"EXPLORING THE MODERN AREAS OF MUMBAI 🇮🇳 I AM SURPRISED! (Marine Drive, BKC, Malabar Hill)",89,0,19,3879325,60621,3981,2023-10-23T11:23:59Z,PT17M26S
10 Best Places to Visit in India - Travel Video,47,0,18,6540540,154703,5673,2019-05-09T10:06:27Z,PT13M30S
India Travel Urdu 2.0 | Amazing facts & History of India | بھارت کی سیر | info at ahsan,87,0,25,840047,9280,1123,2025-05-21T18:20:00Z,PT12M42S
Life in India's last villages - Chitkul and Rakchham | Breathtaking offbeat Himachal | Nishant,94,0,13,1492857,20491,779,2025-08-07T11:55:58Z,PT18M33S
INDIA vs PAKISTAN | Which is BETTER?  🇮🇳 🇵🇰,43,0,26,278646,4993,3218,2025-05-09T11:00:13Z,PT8M57S
ALONE in NEW DELHI ( MY FIRST TIME IN INDIA ),45,0,0,237531,12062,849,2025-08-27T03:00:21Z,PT15M50S
Jaisalmer Tourist Places Complete Tour Guide Vlog | Jaisalmer Trip Plan Itinerary & Budget ,91,0,0,1358901,5424,200,2025-09-25T11:55:29Z,PT14M14S
Extreme Culture Shock in India!| Gurugram Travel Vlog| Rory and Sage World Class Ep.118,87,0,12,408722,7988,846,2025-08-02T12:44:15Z,PT15M45S
Finally Arrived in Meghalaya | First Time in Northeast of India | Shillong,74,0,33,7436,311,74,2026-05-31T05:41:47Z,PT14M37S
Solo Wild Camping in India Took an Unexpected Turn... 🇮🇳 - (North East India #1),80,1,0,67796,2462,424,2026-05-31T08:12:03Z,PT17M59S
Mana - The first Indian village of India in Mana Valley | Uttarakhand | Mana Valley | Badrinath,95,0,19,1060517,10383,352,2025-08-24T13:30:28Z,PT17M45S
ನೋಡ್ರಿ ನೋಡ್ರಿ ಮಲೇಷಿಯ 😍| Kuala Lumpur | Twin Towers | Malaysia | Dr Bro,70,0,19,2925884,143762,2840,2022-09-16T10:30:22Z,PT13M47S
Meghalaya: World’s Wettest Place | Mawsynram Village | North East India,71,0,24,14047210,271517,10478,2023-09-30T05:30:46Z,PT15M41S
How foreign vloggers DEFAME India…,34,0,19,373235,19358,2301,2026-02-21T09:30:08Z,PT13M25S
South India is Mental,21,0,0,1348673,21903,2311,2024-02-23T12:30:39Z,PT17M1S
"A WEEK IN SOUTH INDIA: bollywood inspired shopping spree, my first Tamil wedding & more",87,0,0,321755,13576,343,2025-03-02T23:02:02Z,PT17M47S
PARIS TRAVEL VLOG | Indian Girl Traveling Solo in Paris! 🇫🇷 #KikiInParis Ep 1,77,1,29,871059,27350,906,2021-12-23T14:01:40Z,PT10M23S
"INSIDE THE BIGGEST SLUM IN INDIA 🇮🇳 (It’s intense!) Dharavi, Mumbai.",68,0,11,2374325,30147,4706,2023-10-18T12:42:25Z,PT17M12S
Korean Girl go for Food Hunting in India 🇮🇳 Most Busiest Streets!🇰🇷❤️,69,0,0,3036889,86548,5724,2023-11-27T10:17:56Z,PT19M55S
I Left India – Don't Ever Come Here 🇮🇳,38,0,25,72640,3277,734,2026-01-16T21:29:08Z,PT17M12S
"Our First Day in INDIA - Visiting Broadway Market in Kochi, Kerala 🇮🇳",69,0,21,2688916,69570,5299,2023-03-29T12:33:22Z,PT18M6S
Secret Floating Village in Northeast India | Loktak Lake | Manipur,66,0,16,3058076,73281,3572,2025-08-21T13:00:24Z,PT17M45S
My Trip to India | Exploring Kerala,35,0,26,2883833,125050,5648,2022-12-02T16:11:59Z,PT8M59S
"MALDIVES TRAVEL VLOG: Snorkeling, Dolphin Cruise, Water Villa Tour & More! 🏝️☀️ | Ep 1",86,0,23,4308313,34170,1867,2022-10-16T07:01:37Z,PT15M58S
"Chail Himachal Pradesh Travel Guide | Chail Tourist Places |  Tour Budget Itinerary, Best Staycation",100,0,23,25459,624,37,2026-05-31T05:33:17Z,PT17M19S
Coorg 3 Days Travel Guide | River Rafting & Tourist Places | Budget,67,0,14,355534,2837,146,2025-08-01T08:30:35Z,PT14M27S
Incredible India 4k - The Real India Revealed in 14 Minutes,59,0,24,3263461,65732,3351,2024-03-12T14:00:39Z,PT14M14S
Can India learn from Denmark's happiness?,41,0,15,14076,675,48,2026-05-31T04:02:01Z,PT19M16S
Japan itna SAAF kaise hai  II Moto Vlog II  Indian in Japan II,62,0,37,5978016,106593,4620,2024-08-19T14:11:36Z,PT15M4S
Inside India's FAMOUS Tiger Reserve | Ranthambore National Park 🇮🇳,66,0,21,134590,3117,228,2026-01-03T01:01:17Z,PT17M54S
PONDICHERRY: Exploring French India 🇮🇳 Solo India Travel Vlog,61,0,4,111882,2246,466,2024-08-13T08:38:37Z,PT16M27S
First Class Train Journey in India | Cabin Tour  | Washroom |  Facilities l Train Food Review,93,0,20,40523,677,40,2026-05-22T05:30:12Z,PT15M21S
🇮🇳 Delhi To Nepal Train Journey🇳🇵| India To Nepal By Train | Delhi To Pokhara | India To Nepal,94,0,14,2544,74,19,2026-06-01T05:00:31Z,PT13M1S
17 THINGS I wish I knew BEFORE visiting INDIA,45,0,5,65460,1522,241,2025-05-04T19:58:17Z,PT17M26S
Delhi To Leh Ladakh Road Trip By Car 2026 🚘,43,0,20,7426,120,41,2026-05-31T06:26:20Z,PT14M44S
സിംഗപ്പൂരിലെ വെറൈറ്റി ഫുഡും കാഴ്ചകളും | Singapore Travel Vlog Malayalam - Chinatown & Little India,98,0,16,33939,349,61,2026-05-29T08:00:10Z,PT14M1S
"Bali Travel Guide 2026 | Budget, Itinerary, Scooty Rent, Packages & Tips | Bali Tourist Places",94,0,27,140944,1889,91,2026-03-08T05:30:27Z,PT15M33S
Our Baby's First Trip! 🇮🇹 | World's Most Beautiful City,55,0,22,3556177,121862,5614,2026-05-01T16:03:02Z,PT12M17S
Ladki valo ka kara welcome and dance fun with friends 😍,55,0,35,111444,5674,76,2026-02-04T04:59:20Z,PT19M15S
"Kuwait 🇰🇼 To India 🇮🇳 With IndiGo Airlines | Full Journey, Airport Experience & Travel Update 2026",98,0,16,2786,0,19,2026-06-01T06:04:42Z,PT4M26S
"“India to Thailand Full Travel Guide ✈️ | Bangkok Arrival, Visa & First Vlog 🇮🇳➡️🇹🇭”",84,0,0,13615,225,53,2025-09-17T06:30:34Z,PT10M24S
Kerala’s Most Beautiful Place Munnar | South India | Kolukkumalai | Suryanelli Village,86,0,20,6256097,120418,6150,2024-09-06T12:32:28Z,PT17M2S
Walking Exercise with the SUPER Coaches! | Walk at Home,55,0,25,24121726,198667,711,2023-11-06T13:00:15Z,PT14M54S
15 Minute Dance Workout At Home | Exercise To Lose Weight FAST | Zumba Class,76,0,21,14799,223,12,2026-06-01T22:00:07Z,PT16M21S
Do This Workout Every Evening - 10 Minute Full Body To Get In Shape,67,0,23,11694715,174680,3816,2019-04-25T03:46:52Z,PT10M53S
Tanner Courtad | At-Home Power Walking Workout | Walk at Home®,62,0,25,3198830,46214,336,2024-05-01T20:33:07Z,PT17M47S
LOSE BELLY FAT IN 7 DAYS Challenge | Lose Belly Fat In 1 Week At Home | Cult Fit | CureFit,90,0,26,106092031,2203522,48936,2020-12-04T02:30:10Z,PT12M58S
Build Body at Home Fast (Easy Tips) | Full HOME WORKOUT PLAN for Beginners | Rewirs,83,0,22,1109796,46916,2535,2025-10-10T13:30:56Z,PT9M32S
Top 10 Morning Exercises To Do At Home,38,0,21,27784997,326767,6988,2020-01-23T11:22:28Z,PT19M51S
10-Minute Fast Walking Workout With Tanner Courtad,50,0,15,2108467,34277,552,2025-06-16T16:00:33Z,PT9M52S
Intense 5 Minute At Home Workout to get VEINY ARMS,50,0,13,6923710,67063,711,2023-04-19T11:30:11Z,PT5M2S
11 Min Easy Workout To Do At Home Everyday,42,0,22,1207648,17689,606,2019-03-22T07:37:34Z,PT11M44S
Workout 1 | 15 Minute ULTIMATE BEGINNER Home Workout | The Body Coach App Taster Sessions,89,0,19,265035,4502,153,2025-01-05T21:43:16Z,PT18M48S
5 Exercises for Seniors to Lose Belly Fat,41,0,4,7259043,67261,875,2020-06-19T01:08:36Z,PT6M48S
TOP 10 Exercises to Get Fit At Home!,36,0,34,1761105,45209,498,2023-01-27T12:00:20Z,PT8M11S
Walk 15 Leslie Walk Concert | 15 Minute Walking Workout,55,0,21,12609817,84829,1707,2021-07-19T12:00:09Z,PT13M57S
8 Best Standing Exercises Belly Fat Workout To Lose Weight Fast At Home,71,0,21,21318545,153356,3066,2020-09-10T17:15:01Z,PT6M54S
Heart Healthy - 1 Mile Walk | Walk at Home,42,0,24,17108319,104064,2907,2020-02-28T22:18:59Z,PT17M56S
FLAT TUMMY + STRONG ARMS: ARM & CORE EXERCISES FOR KIDS (15 MINUTES),68,0,9,6852769,27386,0,2023-02-22T12:53:40Z,PT12M46S
15 Minute FAT BURNING Indoor Walking Workout *Full Body*,56,0,16,3466636,46059,3329,2020-04-03T13:26:48Z,PT16M12S
5 Minute Belly Fat Workout! Burn Fat Fast At Home,49,0,22,2001411,27328,601,2024-08-30T10:45:03Z,PT5M38S
7 Min 7 Exercises To Build Big ARMS (NO EQUIPMENT),50,0,17,23699120,270436,3681,2023-05-24T11:30:10Z,PT7M29S
Build Body at Home Fast (100% easy) | Full Home Workout Plan for Beginners ,75,0,0,453594,19462,852,2026-02-26T14:23:50Z,PT13M15S
Beginner Weight Loss Workout - Easy Exercises At Home,53,0,18,6771903,89775,3519,2018-08-31T10:57:37Z,PT17M10S
"""GET STRONG & FAST"" (Kids Exercises To Build Muscle + Increase Speed)",69,0,23,1688931,13392,0,2023-09-02T16:03:04Z,PT15M17S
"""GET FAST"" KIDS WORKOUT (Kids Exercises To Build Speed & Endurance)",67,0,24,5094197,35070,0,2023-09-24T14:30:47Z,PT12M5S
NO GYM - FULL BODY HOME WORKOUT | Students full body workout ,61,0,0,530070,13112,88,2026-03-09T13:52:19Z,PT6M27S
"Do this 10 Min Morning Workout Routine Everyday - No Jumping, No Repeat",71,0,61,7462664,121659,1430,2024-08-21T08:00:06Z,PT13M22S
Need ABS in 5 Min? - Here's How!,32,0,0,8748235,97817,2921,2023-04-28T13:30:09Z,PT4M41S
Kids Exercise - Kids Workout At Home,36,0,21,37034313,217401,0,2018-06-22T18:06:32Z,PT11M46S
Build Body at Home Fast (easy tips) | Full HOME WORKOUT PLAN for Beginners,74,0,18,4649798,172431,2375,2025-08-03T12:31:08Z,PT7M20S
“GET STRONG” Best Core Exercises For Kids (15 Minute Kids Workout),66,0,25,3371039,17199,0,2024-02-04T15:30:04Z,PT15M
15 Min Full Body Standing Workout to Transform Your Shape,57,0,0,9245692,73543,1281,2024-10-09T12:30:50Z,PT15M34S
Bruno Mars Walking Workout | Daily Workout at home | 8 minutes,62,0,21,4253228,84642,2179,2021-10-25T15:30:11Z,PT9M3S
8 Best Exercises To Build Muscle At Home,40,0,21,6219119,138869,4807,2019-01-10T07:46:00Z,PT10M32S
8 Best Exercises To Shrink Stomach Fat Fast,43,0,22,67725495,776758,21622,2018-11-06T09:57:52Z,PT10M36S
NO GYM - FULL BODY HOME WORKOUT | Students full body workout | घर पर कसरत कैसे करें,83,0,22,3395330,77715,1038,2024-08-03T13:45:37Z,PT9M32S
12 Min Lose Weight Fast (Home Workout),38,0,19,1297158,18019,1514,2019-01-08T10:17:28Z,PT12M50S
10 MIN Standing Abs Workout For Men (Lose Belly Fat And Get 6 Pack At Home),75,0,13,2729056,34397,571,2022-03-20T18:37:53Z,PT10M23S
"Full Body Home Workout Only 20 Minutes (No Gym, No Equipment) ",62,0,20,1646198,60289,812,2025-08-24T10:30:03Z,PT8M8S
🔥 7 Day Belly Fat Challenge | 7 Minute Workout to Reduce Visceral Fat 🔥,71,0,17,370900,7517,353,2026-03-30T05:30:06Z,PT10M42S
Do This Chair Workout For 14 Days To Lose Belly Fat (TOP 10 EXERCISES),70,0,16,4092241,59382,851,2022-04-16T00:00:07Z,PT10M15S
"15 MIN FULL BODY WORKOUT || Build Muscle At Home (No Equipment, No Repeat)",74,0,21,133285,5482,250,2026-05-07T18:00:02Z,PT15M39S
Top 5 Flat Belly Exercises (Abs Workout At Home),48,0,22,2918279,29010,606,2018-05-16T19:10:09Z,PT11M46S
10 Standing Exercises To Rid Tummy Fat For Good!,48,0,0,12372216,186499,2432,2023-09-26T12:00:26Z,PT12M7S
"New ""GET STRONG"" KIDS WORKOUT 💪 (@GreysonPumple 's Hardest Workout Yet!)",72,0,23,528802,3598,0,2025-03-23T13:55:50Z,PT16M12S
🔥 15 Minute No Equipment Full Body Workout at Home | Bodyweight Workout 🔥 Lucy Wyndham-Read,91,0,8,96609,3140,218,2026-03-16T06:30:06Z,PT18M36S
💃 Making Exercise Fun with Classics of the 1970's!💃 70's music Dance Workout 💃,78,0,25,2815033,49699,3243,2022-10-10T05:00:21Z,PT19M18S
Grow Taller at Home | 9 Stretching Exercises to Increase Height,63,0,17,7060862,52976,2243,2024-12-23T13:00:31Z,PT8M28S
"Kids ""GET STRONG"" 💪 Full Body Strength Training Workout!🔥",57,0,24,1699722,6171,0,2024-08-24T14:55:02Z,PT11M8S
12 Exercises to Build Strong Abs,32,0,0,5279562,27562,353,2026-03-11T12:30:19Z,PT13M19S
1.0 Mile Happy Walk | Walk at Home | Walking Workout | over 100M Views,70,0,25,76441835,465698,8625,2015-12-11T20:48:16Z,PT15M31S
A+ STUDENT MENTALITY - Best Study Motivation,44,0,29,12339217,477636,13063,2020-10-05T01:00:02Z,PT8M13S
"If you're a lazy but ambitious student, please watch this video.",64,0,10,2228268,138076,2937,2025-04-06T13:00:31Z,PT8M4S
This is Why YOU can't Study 😭| Honest motivation for Students| Kadva Sach|,74,0,31,2175300,128920,78814,2022-09-27T13:34:29Z,PT15M3S
"Getting ADDICTED to STUDYING is Easy, Actually",46,0,31,2704701,154188,2690,2025-04-11T15:34:11Z,PT5M24S
How to Make Your Biggest Academic Comeback 🔥 | Strong Motivational Video For Students,85,0,4,2653250,134950,6512,2024-10-20T12:15:05Z,PT13M7S
Watch This If YOU Can’t Study🔥| Honest Exam Motivation| Prashant Kirad,70,0,23,3380734,180747,63974,2023-10-08T13:19:03Z,PT13M4S
अभी तक कुछ नहीं पढ़ा? बस इतना कर लो🙏| STUDY MOTIVATION,53,0,31,10318,634,40,2026-05-31T13:55:30Z,PT8M2S
UNSTOPPABLE | Powerful Study Motivation in Malayalam | 2025,59,0,19,87037,4201,197,2025-06-03T15:30:31Z,PT5M24S
